{
  "schema": 2,
  "timestamp_utc": "2026-09-18T07:42:46.934263+00:00",
  "host": {
    "os": "Linux-6.18.44-x86_64-with-glibc2.41",
    "machine": "x86_64",
    "cpu": "AMD EPYC 9V74 80-Core Processor",
    "logical_cpus": 5,
    "cpu_affinity": [
      0,
      1,
      2,
      3,
      4
    ],
    "python": "3.13.5",
    "compiler": "/usr/bin/c++",
    "compiler_version": "c++ (Debian 14.2.0-19) 14.2.0"
  },
  "build": {
    "type": "Release",
    "feature_flags": {
      "CFD_ENABLE_OPENMP": "ON",
      "CFD_ENABLE_SYCL": "OFF",
      "CFD_ENABLE_MPI": "OFF",
      "CFD_ENABLE_NATIVE_ARCH": "ON",
      "CFD_FAST_MATH": "OFF",
      "CFD_ENABLE_HDF5": "ON"
    }
  },
  "environment": {
    "OMP_NUM_THREADS": null,
    "CFD_BENCH_THREADS": null
  },
  "mode": {
    "quick": false,
    "scale": 1,
    "repeat": 3
  },
  "results": [
    {
      "schema": 1,
      "version": "0.19.0",
      "feature_set": "phase01_hpc_runtime",
      "case": "poisson_multigrid",
      "backend": "cpu",
      "problem_size": 16129,
      "steps": 6,
      "setup_ms": 0.227976,
      "simulation_ms": 2.131209,
      "total_ms": 2.359185,
      "work_units": 96774,
      "work_unit_name": "unknowns_cycles",
      "throughput": 45408028.96384165,
      "checksum": 6639.851711119266,
      "repeat": 0,
      "target": "cfd-example-phase01-hpc"
    },
    {
      "schema": 1,
      "version": "0.19.0",
      "feature_set": "phase02_lbm",
      "case": "taylor_green_d3q19",
      "backend": "cpu",
      "problem_size": 110592,
      "steps": 80,
      "setup_ms": 5.45658,
      "simulation_ms": 528.245404,
      "total_ms": 533.701984,
      "work_units": 8847360,
      "work_unit_name": "cell_steps",
      "throughput": 16748579.226635354,
      "checksum": 110609.77375653926,
      "repeat": 0,
      "target": "cfd-example-phase02-lbm"
    },
    {
      "schema": 1,
      "version": "0.19.0",
      "feature_set": "phase03_fvm",
      "case": "lid_driven_cavity_piso",
      "backend": "cpu",
      "problem_size": 576,
      "steps": 8,
      "setup_ms": 0.493407,
      "simulation_ms": 10.088013,
      "total_ms": 10.58142,
      "work_units": 4608,
      "work_unit_name": "cell_steps",
      "throughput": 456779.7444353016,
      "checksum": 292.7563759040518,
      "repeat": 0,
      "target": "cfd-example-phase03-fvm"
    },
    {
      "schema": 1,
      "version": "0.19.0",
      "feature_set": "phase04_fem",
      "case": "dynamic_cantilever_bar",
      "backend": "cpu",
      "problem_size": 257,
      "steps": 1200,
      "setup_ms": 0.154628,
      "simulation_ms": 10.296601,
      "total_ms": 10.451229000000001,
      "work_units": 308400,
      "work_unit_name": "dof_steps",
      "throughput": 29951631.611247245,
      "checksum": 0.00044120285587686045,
      "repeat": 0,
      "target": "cfd-example-phase04-fem"
    },
    {
      "schema": 1,
      "version": "0.19.0",
      "feature_set": "phase05_fdtd",
      "case": "dielectric_pulse_cpml",
      "backend": "cpu",
      "problem_size": 4096,
      "steps": 2500,
      "setup_ms": 0.33939,
      "simulation_ms": 41.507616,
      "total_ms": 41.847006,
      "work_units": 10240000,
      "work_unit_name": "cell_steps",
      "throughput": 246701713.72887328,
      "checksum": 8.0263904384643e-15,
      "repeat": 0,
      "target": "cfd-example-phase05-fdtd"
    },
    {
      "schema": 1,
      "version": "0.19.0",
      "feature_set": "phase06_optics",
      "case": "biconvex_ray_bundle",
      "backend": "cpu",
      "problem_size": 31413,
      "steps": 1,
      "setup_ms": 0.676217,
      "simulation_ms": 3.067409,
      "total_ms": 3.743626,
      "work_units": 31413,
      "work_unit_name": "rays",
      "throughput": 10240890.601807583,
      "checksum": 31413.09738870463,
      "repeat": 0,
      "target": "cfd-example-phase06-optics"
    },
    {
      "schema": 1,
      "version": "0.19.0",
      "feature_set": "phase07_chemistry_corrosion",
      "case": "reactor_plus_phase_field_corrosion",
      "backend": "cpu",
      "problem_size": 1024,
      "steps": 1000,
      "setup_ms": 0.02732,
      "simulation_ms": 4.43842,
      "total_ms": 4.465739999999999,
      "work_units": 1024350,
      "work_unit_name": "cell_steps",
      "throughput": 230791587.99753064,
      "checksum": -305.062004733626,
      "repeat": 0,
      "target": "cfd-example-phase07-chemistry-corrosion"
    },
    {
      "schema": 1,
      "version": "0.19.0",
      "feature_set": "phase08_multiphysics",
      "case": "joule_heating_thermal",
      "backend": "cpu",
      "problem_size": 2304,
      "steps": 80,
      "setup_ms": 0.12921,
      "simulation_ms": 32.89767,
      "total_ms": 33.02688,
      "work_units": 184320,
      "work_unit_name": "element_steps",
      "throughput": 5602828.406996606,
      "checksum": 301.3200460682442,
      "repeat": 0,
      "target": "cfd-example-phase08-multiphysics"
    },
    {
      "schema": 1,
      "version": "0.19.0",
      "feature_set": "phase10_rf",
      "case": "microstrip_frequency_sweep",
      "backend": "cpu",
      "problem_size": 50000,
      "steps": 1,
      "setup_ms": 0.0001,
      "simulation_ms": 8.07681,
      "total_ms": 8.07691,
      "work_units": 50000,
      "work_unit_name": "frequency_points",
      "throughput": 6190562.858356208,
      "checksum": 55633.731760090894,
      "repeat": 0,
      "target": "cfd-example-phase10-rf"
    },
    {
      "schema": 1,
      "version": "0.19.0",
      "feature_set": "phase11_spice",
      "case": "rc_transient_bdf2",
      "backend": "cpu",
      "problem_size": 3,
      "steps": 20000,
      "setup_ms": 0.027891,
      "simulation_ms": 7.644002,
      "total_ms": 7.671893000000001,
      "work_units": 20000,
      "work_unit_name": "time_steps",
      "throughput": 2616430.503288722,
      "checksum": 0.9999999969387671,
      "repeat": 0,
      "target": "cfd-example-phase11-spice"
    },
    {
      "schema": 1,
      "version": "0.19.0",
      "feature_set": "phase12_em_pic",
      "case": "periodic_em_pic_beam",
      "backend": "cpu",
      "problem_size": 4000,
      "steps": 80,
      "setup_ms": 2.367027,
      "simulation_ms": 486.708055,
      "total_ms": 489.075082,
      "work_units": 320000,
      "work_unit_name": "particle_steps",
      "throughput": 657478.331645857,
      "checksum": 4.427112853934052e-12,
      "repeat": 0,
      "target": "cfd-example-phase12-em-pic"
    },
    {
      "schema": 1,
      "version": "0.19.0",
      "feature_set": "phase13_multibody_dem",
      "case": "granular_settling",
      "backend": "cpu",
      "problem_size": 180,
      "steps": 600,
      "setup_ms": 0.041351,
      "simulation_ms": 16.664393,
      "total_ms": 16.705744,
      "work_units": 108000,
      "work_unit_name": "particle_steps",
      "throughput": 6480884.122211953,
      "checksum": 32.41305050400029,
      "repeat": 0,
      "target": "cfd-example-phase13-dem"
    },
    {
      "schema": 1,
      "version": "0.19.0",
      "feature_set": "phase14_acoustics",
      "case": "photoacoustic_kspace2d",
      "backend": "cpu",
      "problem_size": 16384,
      "steps": 160,
      "setup_ms": 1.125278,
      "simulation_ms": 849.718439,
      "total_ms": 850.843717,
      "work_units": 2621440,
      "work_unit_name": "cell_steps",
      "throughput": 3085068.9824797367,
      "checksum": 14770.695587883221,
      "repeat": 0,
      "target": "cfd-example-phase14-acoustics"
    },
    {
      "schema": 1,
      "version": "0.19.0",
      "feature_set": "phase15_tcad",
      "case": "pn_diode_iv",
      "backend": "cpu",
      "problem_size": 151,
      "steps": 10,
      "setup_ms": 0.01331,
      "simulation_ms": 37.076937,
      "total_ms": 37.090247,
      "work_units": 1510,
      "work_unit_name": "nodes_bias_points",
      "throughput": 40726.12578541749,
      "checksum": -1.412977821226665e-14,
      "repeat": 0,
      "target": "cfd-example-phase15-tcad"
    },
    {
      "schema": 1,
      "version": "0.19.0",
      "feature_set": "phase16a_battery",
      "case": "spme_drive_cycle",
      "backend": "cpu",
      "problem_size": 124,
      "steps": 1740,
      "setup_ms": 0.007231,
      "simulation_ms": 7.890295,
      "total_ms": 7.897526,
      "work_units": 215760,
      "work_unit_name": "state_steps",
      "throughput": 27344985.200173125,
      "checksum": 302.0394113250169,
      "repeat": 0,
      "target": "cfd-example-phase16a-battery"
    },
    {
      "schema": 1,
      "version": "0.19.0",
      "feature_set": "phase01_hpc_runtime",
      "case": "poisson_multigrid",
      "backend": "cpu",
      "problem_size": 16129,
      "steps": 6,
      "setup_ms": 0.222487,
      "simulation_ms": 2.103169,
      "total_ms": 2.325656,
      "work_units": 96774,
      "work_unit_name": "unknowns_cycles",
      "throughput": 46013420.699905716,
      "checksum": 6639.851711119266,
      "repeat": 1,
      "target": "cfd-example-phase01-hpc"
    },
    {
      "schema": 1,
      "version": "0.19.0",
      "feature_set": "phase02_lbm",
      "case": "taylor_green_d3q19",
      "backend": "cpu",
      "problem_size": 110592,
      "steps": 80,
      "setup_ms": 5.790191,
      "simulation_ms": 570.891839,
      "total_ms": 576.68203,
      "work_units": 8847360,
      "work_unit_name": "cell_steps",
      "throughput": 15497436.459237944,
      "checksum": 110609.77375653926,
      "repeat": 1,
      "target": "cfd-example-phase02-lbm"
    },
    {
      "schema": 1,
      "version": "0.19.0",
      "feature_set": "phase03_fvm",
      "case": "lid_driven_cavity_piso",
      "backend": "cpu",
      "problem_size": 576,
      "steps": 8,
      "setup_ms": 0.418256,
      "simulation_ms": 10.613298,
      "total_ms": 11.031554,
      "work_units": 4608,
      "work_unit_name": "cell_steps",
      "throughput": 434172.2996942138,
      "checksum": 292.7563759040518,
      "repeat": 1,
      "target": "cfd-example-phase03-fvm"
    },
    {